{
  "$schema": "https://json-schema.org/draft/2020-12/schema",
  "$id": "https://grandchallenge.ai/schemas/retrospective_review_attestation.schema.json",
  "title": "MATHFORGE Retrospective Review Attestation",
  "type": "object",
  "additionalProperties": false,
  "required": [
    "schema_version",
    "record_id",
    "campaign_id",
    "subject",
    "historical_finding",
    "remedy_contract",
    "activation",
    "gate_effect",
    "claim_boundary"
  ],
  "properties": {
    "schema_version": {"const": "1.0.0"},
    "record_id": {"const": "MF-OTP-REVIEW-REMEDY-001"},
    "campaign_id": {"const": "OPENAI-TEN-PROOFS-001"},
    "subject": {
      "type": "object",
      "additionalProperties": false,
      "required": ["repository", "pull_request", "head_sha", "merge_commit_sha", "original_author"],
      "properties": {
        "repository": {"const": "grandchallenge/MATHFORGE"},
        "pull_request": {"const": 39},
        "head_sha": {"const": "6dcf5d64f221f67a3f498578775a3ffb034801ff"},
        "merge_commit_sha": {"const": "72452f4579749448169cacf9f2ab22a4df2bb182"},
        "original_author": {"const": "fyremael"}
      }
    },
    "historical_finding": {
      "type": "object",
      "additionalProperties": false,
      "required": ["submitted_review_count", "review_gate_satisfied_at_merge", "history_may_be_rewritten"],
      "properties": {
        "submitted_review_count": {"const": 0},
        "review_gate_satisfied_at_merge": {"const": false},
        "history_may_be_rewritten": {"const": false}
      }
    },
    "remedy_contract": {
      "type": "object",
      "additionalProperties": false,
      "required": [
        "tracker_issue",
        "attestation_pull_request",
        "required_event",
        "reviewer_must_differ_from_original_author",
        "reviewer_role",
        "conversation_comment_is_sufficient",
        "reaction_is_sufficient",
        "merge_action_is_sufficient",
        "reapproval_required_after_head_change",
        "required_review_assertions"
      ],
      "properties": {
        "tracker_issue": {"const": 40},
        "attestation_pull_request": {"type": ["integer", "null"], "minimum": 1},
        "required_event": {"const": "APPROVED"},
        "reviewer_must_differ_from_original_author": {"const": true},
        "reviewer_role": {"const": "MATHFORGE maintainer"},
        "conversation_comment_is_sufficient": {"const": false},
        "reaction_is_sufficient": {"const": false},
        "merge_action_is_sufficient": {"const": false},
        "reapproval_required_after_head_change": {"const": true},
        "required_review_assertions": {
          "type": "array",
          "minItems": 5,
          "maxItems": 5,
          "uniqueItems": true,
          "items": {
            "enum": [
              "reviewer_independence",
              "exact_subject_identity_reviewed",
              "pr39_evidence_and_fail_closed_routes_accepted",
              "retrospective_nature_and_historical_variance_acknowledged",
              "no_mathematical_or_downstream_gate_promotion"
            ]
          }
        }
      }
    },
    "activation": {
      "type": "object",
      "additionalProperties": false,
      "required": ["state", "condition", "effect_is_retroactive"],
      "properties": {
        "state": {"const": "proposed_until_non_author_approval_and_protected_merge"},
        "condition": {"const": "attestation PR receives a non-author maintainer APPROVED review on its final exact head and is then protected-merged"},
        "effect_is_retroactive": {"const": false}
      }
    },
    "gate_effect": {
      "type": "object",
      "additionalProperties": false,
      "required": [
        "independent_governance_after_activation",
        "source_gate_clear_count",
        "admitted_result_count",
        "solve_handoffs_opened",
        "may_adjudicate_in_mathcert",
        "may_promote_claims"
      ],
      "properties": {
        "independent_governance_after_activation": {"const": "prospectively_remediated_by_retrospective_attestation"},
        "source_gate_clear_count": {"const": 0},
        "admitted_result_count": {"const": 0},
        "solve_handoffs_opened": {"const": 0},
        "may_adjudicate_in_mathcert": {"const": false},
        "may_promote_claims": {"const": false}
      }
    },
    "claim_boundary": {"type": "string", "minLength": 100}
  }
}
